{
  "specVersion": "0.2.0",
  "title": "Open Tech Events Spain",
  "description": "Eventos de comunidades técnicas en España.",
  "url": "https://opentechevents.org",
  "license": "CC-BY-4.0",
  "licenseUrl": "https://creativecommons.org/licenses/by/4.0/",
  "updatedAt": "2026-07-06T10:00:00Z",
  "events": [
    {
      "id": "https://rustmadrid.example/meetup/2026-06",
      "url": "https://rustmadrid.example/meetup/2026-06",
      "name": "Rust Madrid — June meetup",
      "description": "Talks on WASM and Rust tooling.",
      "startDate": "2026-06-26T19:00:00",
      "endDate": "2026-06-26T21:00:00",
      "timezone": "Europe/Madrid",
      "attendanceMode": "hybrid",
      "location": {
        "venue": "Campus Madrid, Calle de Moreno Nieto 2, Madrid",
        "onlineUrl": "https://meet.example/rust-madrid"
      },
      "languages": ["es"]
    },
    {
      "id": "https://coolconf.example/2026/",
      "url": "https://coolconf.example/2026/",
      "name": "CoolConf 2026",
      "startDate": "2026-10-15",
      "endDate": "2026-10-16",
      "timezone": "Europe/Madrid",
      "attendanceMode": "in-person",
      "location": { "venue": "Valencia, Spain" },
      "status": "cancelled",
      "license": "CC0-1.0"
    }
  ]
}
